PostId;StudentId;Content
3;493;"Hallo Carina, Cassandra und Tim :)Habt ihr schon Vorgehensvorschlge fr die Bearbeitung der Aufgabe? Und wisst ihr schon, wann ihr dafr am besten Zeit habt?Ich werde heute die Basisliteratur lesen und htte jeden Tag Zeit, einmal ins Forum zu schauen, zum effektiven Mitarbeiten am Text komme ich aber wahrscheinlich erst Donnerstag/Freitag. Wre das okay fr euch?LG Mark"
4;481;"Hallo Miteinander,ich bin leider gerade erst dazu gekommen, mir die Inhalte durchzulesen und die Aufgabenstellung zu bearbeiten.Die Aufgabenstellung ist ja im Prinzip, was beim Brainstorming bei 8 Leuten in einem Raum beachtet werden sollte. Es wurden zum einen von Osborn vier Regeln aufgestellt, die beim Brainstorming entscheidend sind. 1. Je mehr Ideen desto besser, 2. Je ungewhnlicher die Idee, desto besser, 3. Verbessere und Ergnze bereits genannte Ideen, 4. Enthalte dich jeglicher Kritik.Allerdings wurden im Nachhinein Experimente dazu durchgefhrt und es zeigte sich, dass die Regeln in der Realitt nicht eingehalten werden knnen bzw.es dennoch Probleme beim Brainstorming gibt. Zum einen soll eigentlich in der Gruppe keine Kritik an Mitarbeitern ausgebt werden, dennoch ist es in der Realitt so, dass trotzdem Mitglieder Angst davor haben Iden auszusprechen, weil sie mglicherweise falsch sein knnten. Zudem lehnen sich einige MItarbeiter beim Brainstorming in der Gruppe zurck und lassen eher andere arbeiten, obwohl sie selbst gute Ideen beisteuern knnten. Und zum anderen kann es passieren, dass Denkprozesse von Mitgliedern gestrt werden knnen, indem dieser einem anderen gleichzeitig beim Reden zuhren mchte. Um diese genannten Probleme zu vermeiden, wrde ich vorschlagen, dass Brainwriting durchgefhrt werden sollte. So sollte jeder Mitarbeiter seine Ideen auf einem Zettel aufschreiben und anschlieend sollten die Zettel ausgetauscht werden. Zum einen werden somit keine Denkprozesse unterbrochen und zum anderen kann gesehen werden, was jeder Mitarbeiter gemacht hat und ob er sich Gedanken gemacht hat. So kann das Problem des sozialen Faulenzen umgangen werden. Um nun noch die Anonymitt zu verbergen um somit die Angst etwas falsches zu sagen bzw in dem Fall aufzuschreiben, knnen entweder alle Zettel eingesammelt werden und vermischt werden, sodass kein Rckschluss gezogen werden kann, von wem welche Idee kommt. In diesem Fall wird das soziale Faulenzen eventuell wieder ein Problem, wobei ich der Meinung bin, dass trotz Anonymitt keiner einen leeren Zettel abgeben mchte. Habt ihr eventuell andere Vorschlge oder knntet noch etwas hinzufgen?Viele Gre,Carina"
5;460;"Hey ihr!erst einmal sorry, dass ich mich jetzt erst melde. Hatte diese Woche 3 Referate, die meine Aufmerksamkeit gefordert haben...Ich werde mich jetzt an die Literatur machen. Carina, deine Ideen hren sich schon einmal sehr vielversprechend an :)LG Tim"
6;460;"So, mittlerweile bin ich nun auch etwas schlauer, was das brainstorming betrifft.Die drei groen Probleme des Brainstormings (Bewertungsangst, Trittbrettfahrer, Blockierung) sollten ja mglichst umgangen werden. Aus diesem Grund finde ich die Idee des Durchfhrens des Brainwritings ziemlich gut. Was haltet ihr denn fr unseren konkreten Fall von folgender Idee.Die 8 Mitarbeiter befinden sich mit dem Chef beim anberaumten Meeting (s. Aufgabenstellung). Der Chef stellt die Problematik vor und bittet die Mitarbeiter darum, sich bis zum darauf folgenden Tag Gedanken bezglich einer Lsung zu machen (quasi individuelles Brainstorming bzw. Brainwriting; zu hause oder so). Am nchsten Tag teilt der Chef seine Mitarbeiter in 2 Gruppen auf (je 4), welche sich dann gegenseitig ihre vorab gemachten Gedanken vorstellen und bewerten (evt. neue Ideen entwickeln?!). Im Anschluss daran berlegt jede Gruppe fr sich, welche Vorschlge am Besten sind (und notiert diese). Schlielich setzen sich beide Gruppen zusammen, stellen sich gegenseitig ihre Vorschlge vor und alle entscheiden dann zusammen, welcher Vorschlag am sinnigsten ist, um im Broalltag den Abfall zu reduzieren. Dieser Vorschlag entspricht eventuell nicht ganz der Aufgabenstellung, aber ich denke, dass er im Broalltag so ganz gut umgesetzt werden  knnte ;) LG Tim"
7;493;"Hallo Carina und Tim (und Cassandra)!Ich finde dein Text, Carina, gibt schon einmal eine gute Strukturierung der Aufgabenbeantwortung vor (Osborn, Experimente, Probleme, Brainwriting).Brainwriting finde ich auch eine gute Lsung fr das Problem. Auch deinen Ansatz, Tim, finde ich interessant.Ich denke, wir knnten ja verschiedene Versionen vorschlagen:1) Eine aufwendigere mit privatem Brainwriting, zwei Gruppen, die sich dann austauschen (Tim).2) Und eine einfachere, alle im gleichen Raum aber erst einmal fr sich aufschreibend (Carina). 3) Aus der Praxis kenne ich es so: alle schreiben erst einmal auf Moderationskarten ihre Ideen persnlich, dann werden diese (anonym) eingesammelt und fr alle sichtbar ausgelegt bzw. an eine Pinnwand geheftet. Im nchsten Schritt wird dann noch einmal gebrainstormed (wieder jeder fr sich), damit man sich auch von den Vorschlgen der anderen inspirieren lassen kann (kognitive Stimulierung).4) Im digitalen Zeitalter knnte ich mir auch elektronisches Brainstorming gut vorstellen. Also schnell eine WhatsApp-Gruppe grnden und Ideen eingeben und sich gleichzeitig von den anderen inspirieren lassen...Fr diese Vorschlge wre ja die berschrift sozusagen dem Chef empfehlen, Produktionsblockierung zu vermindern und Stimulierung wahrscheinlicher zu machen.Fr die Bewertungsangst- und Trittbrettfahrerprobleme knnte ich mir noch vorstellen, dass der Chef sich dieser Thematik bewusst ist und entsprechend seine Instruktion gestaltet: Quantitt vor Qualitt, keine Kritik (Osborn-Prinzipien) - das hilft der Kreativitt - und mir ist der Beitrag jedes einzelnen Teammitglieds wichtig. Das heisst auch, dass er, wenn z.B. die persnlichen Ideen fr alle sichtbar gemacht werden, darauf geachtet wird, dass keine Bewertungen vorgenommen werden (Das ist ja mal eine coole Idee! Von wem ist die? oder auch Nee, unrealistisch oder Das knnen wir gleich vergessen - leider passiert das meiner Erfahrung nach in der Praxis recht hufig). Ansonsten das, was Carina schon schreibt: inhaltliche Anonymitt gegen die Bewertungsangst, aber sichtbares Ideenaufschreiben (z.B. 1 Moderationskarte pro Idee) gegen Trittbrettfahrerprobleme.Beste GrsseMark"
8;493;"Brainstorming Der Werbefachmann Alex Osborn rief das so genannte Brainstorming mit einem Artikel 1953 ins ffentliche Leben. Fr ihn bestand ein kreativer Problemlsungsprozess aus drei Phasen: Fact-Finding, Idea-Finding und Solution-Finding. Um auf gute Ideen zu kommen, schlug Osborn vor, die Ideengenerierung von der Ideenbewertung zu trennen und deswegen zunchst einmal Kritik aufzuschieben und auf Quantitt der Ideen zu setzen. So sollte es wahrscheinlicher gemacht werden, dass sich unter den vielen verschiedenen Ideenauch qualitativ gute befinden. Er stellte vier Regeln auf: 1) Je mehr Ideen, desto besser; 2) Je ungewhnlicher die Ideen, desto besser; 3) verbessere und ergnze bereits genannte Ideen; 4) enthalte dich jeglicher Kritik. Diese Methode erfreute sich ber die Jahre hinweg bis heute in Organisationen grosser Beliebtheit, und auch die Prinzipien sind vielfach bekannt. Doch Osborns Anspruch, durch diese Methode die Gruppenkreativitt der individuellen berlegen zu machen, wurde, wie wissenschaftliche Experimente zeigten, diese Methode nicht gerecht. So zeigte sich, dass Individuen, die unabhngig voneinander Ideen entwickelten und deren individuelle Ergebnisse zu einem formalen Gruppenergebnis kombiniert wurden (Nominalgruppe), mehr und bessere Ideen entwickelten als echte Gruppen. BewertungsangstTrittbrettfahren Produktionsblockierung Kognitive Stimulierung Empfehlungen an den Chef"
9;493;"Hallo nochmals :)Ich habe jetzt im Etherpad mal einen Anfang gemacht zu Osborns Brainstormingberlegungen und folgende Punkte zum Fllen vorgeschlagen: Brainstorming, Bewertungsangst, Trittbrettfahren, Produktionsblockierung, Kognitive Stimulierung und Empfehlungen an den Chef. Am besten schaut ihr einfach mal rein und gebt hier Feedback :)LG Mark"
10;493;"So zeigte sich, dass Individuen, die unabhngig voneinander Ideen entwickelten und deren individuelle Ergebnisse zu einem formalen Gruppenergebnis kombiniert wurden (Nominalgruppe), mehr und bessere Ideen entwickelten als echte Gruppen (vgl. Taylor, Berry und Block, 1958; Mullen, Johnson & Salas, 1991)."
11;481;"Hey, Verzeihung, ich liege seit Freitag krank im Bett. Ich habe mir aber nun eure Kommentare durchgelesen und finde es erst mal gut, dass wir vier verschieden Lsungsanstze haben. Zum einen finde ich Tims Idee auch gut, dass das brainwriting auerhalb stattfindet und der Lsungsansatz, wie es in der Praxis heut ist, von marc, finde ich auch sehr wichtig und wrde den auch gerne mit in den text mit aufnehmen. Den vierten Vorschlag, mit der digitalen Lsung finde ich persnlich nicht so gut - da hier auch die Anonymitt nicht verhindert wird, bei einer WhatsApp gruppe. Und ich den anonymittsfaktot persnlich fr sehr wichtig halte, aber da das lediglich ein persnliches empfinden ist, knnen wir das auch mit aufnehmen, da es ja auch positive Aspekte hat, die beachtet werden sollten. Zu Tims text: ist auf jeden fall genehmigt! Ist alles drin, was rein muss und wurde sehr gut geschrieben. Danke!Wollen wir die vier Ideen  och unter den text schreiben oder wie hattet ihr euch das gedacht?VG Carina"
12;460;"Hey :)klasse, dass wir hier so viele, verschiedene mgliche Lsungsanstze finden! Was haltet ihr denn davon, wenn wir, wie bereits vorgeschlagen, einfach die Knackpunkte des Textes benennen (so wie Mark dies schon im Etherpad angefangen hat) und dann im Anschluss einfach unsere Vorschlge (a,b,c,...) niederschreiben?! LG TimPS: Gute Besserung Carina :) "
13;460;"BewertungsangstTrittbrettfahrenProduktionsblockierungKognitive StimulierungEmpfehlungen an den Chef bzw. mgliche Herangehensweisen:    a)        b)        c)        d) Die 8 Mitarbeiter befinden sich mit dem Chef beim anberaumten Meeting (s. Aufgabenstellung). Der Chef stellt die Problematik vor und bittet die Mitarbeiter darum, sich bis zum darauf folgenden Tag Gedanken bezglich einer Lsung zu machen ( individuelles Brainstorming bzw. Brainwriting). Am nchsten Tag teilt der Chef seine Mitarbeiter in 2 Gruppen auf (je 4 Teilnehmer), welche sich dann gegenseitig ihre vorab gemachten Gedanken vorstellen und bewerten (und evt. noch neue Ideen entwickeln). Im Anschluss daran berlegt jede Gruppe fr sich, welche Vorschlge umsetzbar sind (und notiert diese). Schlielich setzen sich beide Gruppen zusammen, stellen sich gegenseitig ihre Vorschlge vor und alle entscheiden dann zusammen, welcher Vorschlag am sinnigsten ist, um im Broalltag den Abfall zu reduzieren."
14;460;"BewertungsangstBei der Bewertungsangst geht es darum, dass Mitglieder einer Gruppe ihre Ideenproduktion aus Angst vor Bewertung einer Selbstzensur unterwerfen. Dadurch kommt es zur Unterdrckung von (besonderes) kreativen Ideen. Sttzung fr diese Erklrung kam von einer Untersuchung von Collaros undAnderson (1969), die Bewertungsangst in einem Teil ihrer Gruppen dadurch zu vergrern versuchten, dass sie jedes Mitglied glauben lieen, alle anderen wren Experten auf dem Diskussionsthema. Erwartungsgem erzeugten dieseGruppen weniger Ideen als Kontrollgruppen, deren Mitglieder von einem homogenen Kenntnisstand ausgingen. TrittbrettfahrenMit der Trittbrettfahrerhypothese (Stroebe 1981) wird das Phnomen  beschrieben, wenn eine Personvon der Leistung Anderer profitiert. Dabei erhhen sowohl eine geringe Identifizierbarkeit des eigenen Beitrages sowie  das Gefhl einer hohen Ersetzbarkeit innerhalbeiner Gruppe die Motivation zum Trittbrettfahren in Gruppen, wobei die Identifizierbarkeit einerseits mit zunehmender Gruppengre abnimmt und die wahrgenommene Ersetzbarkeit andererseits zunimmt. Stroebe (1981) fand in diesem Zusammenhang zudem heraus, dass Leistungsverluste in Gruppen mit zunehmender Gruppengre zunehmen (Bouchard & Hare, 1970; Nijstad, Stroebe &Lodewijkx, 1999) und dass eine feste Reihenfolge der Ideenuerung den Produktivittsverlust senkt (Bouchard & Hare, 1970). Nichtsdestotrotz kamen Diehl und Stroebe(1987) letztlich zu der Schlussfolgerung, dass Trittbrettfahrereffekte zwar zum Produktivittsverlust von Gruppen beitragen, aber nicht die Hauptursache fr diese Leistungsverluste sind. Produktionsblockierung Kognitive Stimulierung Empfehlungen an den Chef bzw."
15;460;"Hi,so, ich habe im Etherpad mal ein wenig herumgeschustert. Wollt ihr vll. die restlichen Lcken fllen, soweit ihr knnt? Werde es wahrscheinlich erst heute Abend gegen 10 wieder schaffen, ins Etherpad zu schauen...LG Tim "
16;493;"Super!Ich werde mich jetzt noch einmal an den Text setzen und etwas fllen.Gute Besserung, Carina!Beste Grsse &amp; schner 1. AdventMark"
17;493;"Als Grnde fr die Leistungsverluste wurden Bewertungsangst, Trittbrettfahren und Produktionsblockierung erforscht. Produktionsblockierung Lamm und Trommsdorf (1973) vermuteten bereits, dass gegenseitige Produktionsblockierung beim Brainstorming zu Leistungsverlusten fhrte. Gesprchskonventionen fhren dazu, dass jeweils nur ein Gruppenmitglied zu einer Zeit redet. Diehl und Stroebe (1987) manipulierten  in einem Experiment die Produktionsblockierung, indem Personen in separaten Rumen Ideen generierten und ihnen eine Ampel anzeigte, ob andere gerade sprachen oder nicht. Eine Gruppe musste die Ampel nicht beachten  sie erzeugtedie meisten Ideen. Eine Gruppe musste die Ampel beachten, hrte aber nicht, was andere sagten. Sie erzeugte weniger Ideen. Am wenigsten Ideen erzeugte die Gruppe, die Ampel beachten musste und die tatschlichen Redebeitrge der anderen auch hrten. Dies gilt als Besttigung fr die Bedeutung der Produktionsblockierung in Brainstorminggruppen. Experimente, die einennicht-verbalen Austausch von Ideen ermglichen, gehen in die gleiche Richtung. Diehl und Stroebe (1991) vermuten, dass die Begrenztheit des Kurzzeitgedchtnisses zur Produktionsblockierung fhrt. Diese kognitive Perspektive konnte experimentell besttigt werden (Stroebe und Nijstad, 2004). So knnen Redebeitrge anderer die Aktivierung von Einheiten des Langzeitgedchtnisses stren als auch die Weiterfhrung der Gedankengnge. Kognitive StimulierungFindet keine Produktionsblockierung statt, z.B. aufgrund eines schriftlichen Brainstormings wie das Brainwriting, kann der Austausch von Ideen zu kognitiver Stimulierung fhren. So knnen, aus kognitiver Perspektive, Ideen anderer dazu fhren, dass schneller ein Sondierungscue zusammengestellt wird, mit dem im Gedchtnis nach entsprechendem Wissen gesucht wird, und dass Wissen aktiviert wird, das sonst nicht aktiviert worden wre (z.B. bei semantisch heterogene Ideen). Empfehlungen an den Chef bzw. mgliche Herangehensweisen    Unsere Empfehlungen gehen dahin, Bewertungsangst, Trittbrettfahren und Produktionsblockierung zu vermindern sowie kognitive Stimulierung zu vergrssern. a) Jeder Mitarbeiter sollte seine Ideen auf einem Zettel aufschreiben und anschlieend sollten die Zettel ausgetauscht werden. Zum einen werden somit keine Denkprozesse unterbrochen und zum anderen kann gesehen werden, was jeder Mitarbeiter gemacht hat und ob er sich Gedanken gemacht hat. So kann das Problem des sozialen Faulenzen umgangen werden. Um nun noch die Anonymitt zu verbergen um somit die Angst etwas falsches zu sagen bzw in dem Fall aufzuschreiben, knnen entweder alle Zettel eingesammelt werden und vermischt werden, sodass kein Rckschluss gezogen werden kann, von wem welche Idee kommt. In diesem Fall wird das soziale Faulenzen eventuell wieder ein Problem, wobei wir der Meinung sind, dass trotz Anonymitt keiner einen leeren Zettel abgeben mchte. b) Alle schreiben erst einmal auf Moderationskarten ihre Ideen persnlich auf, dann werden diese (anonym) eingesammelt und fr alle sichtbar ausgelegt bzw. an eine Pinnwand geheftet. Im nchsten Schritt wird dann noch einmal gebrainstormed (wieder jeder fr sich), damit man sich auch von den Vorschlgen der anderen inspirieren lassen kann. Inhaltliche Anonymitt hilft so gegen Bewertungsangst, sichtbares Kartenschreiben gegen Trittbrettfahren und das Einsehen der Karten der anderen nach der ersten Runde zu kognitiver Stimulierung. c) Die 8 Mitarbeiter befinden sich mit dem Chef beim anberaumten Meeting. Der Chef stellt die Problematik vor und bittet die Mitarbeiter darum, sich bis zum darauf folgenden Tag Gedanken bezglich einer Lsung zu machen (individuelles Brainstorming bzw. Allgemeiner knnte gegen Bewertungsangst- und Trittbrettfahrerprobleme auch helfen, dass der Chef sich dieser Thematik bewusst ist und entsprechend seine Instruktion gestaltet: Quantitt vor Qualitt, keine Kritik (Osborn-Prinzipien) - das hilft der Kreativitt - und mir ist der Beitrag jedes einzelnen Teammitglieds wichtig. Das heisst auch, dass er, wenn z.B. die persnlichen Ideen fr alle sichtbar gemacht werden, darauf geachtet wird, dass keine Bewertungen vorgenommen werden (Das ist ja mal eine coole Idee! Von wem ist die? oder auch Nee, unrealistisch oder Das knnen wir gleich vergessen)."
18;493;"Ps: Ja, Carina, du hast Recht, bei WhatsApp kann ja eingesehen werden, wer was schreibt. Daran hatte ich gar nicht gedacht.Ich habe den Text jetzt vervollstndigt. Vielleicht knnt ihr noch einmal drberschauen, ob das so passt.Beste GrsseMark"
19;460;"Hey Mark,super, das Ergebnis sieht doch jetzt klasse aus! Ich denke, das knnen wir so lassen. :)Schnen Abend noch,LG Tim"
